Subreddit,SubmissionID,CommentID,text,date,Stephen,TJ,Alexis,Veronica
ModeratePolitics,t3_o13gwa,h1yleyh,">Willis Carrier was granted the patent for his Apparatus for Treating Air, the first modern air conditioner, on January 2, 1906. \n\nThe ratification of the Bill of Rights was completed on December 15, 1791.\n\nWas the entire US in violation of the Eighth Amendment for 114 years and 18 days? \n\nI'm being snarky here, but my underlying point is that just because circumstances change, that doesn't mean that the laws do. If people think there's a right to climate control, pass another amendment. But don't just say that it's so.\n	>Law has historically changed based on technology. Abortion rights are one of the major hot-button issues right now that is centered around the viability of a child. Something that is purely driven by technology.\n		>But there's a good way and a bad way to do that. Good way is when legislators first allow the technology to proliferate to see how people use it, then they pass laws to deal with it. The bad way is to just force the tech under existing laws as the article is proposing. \n		\n		Yes, air conditioning has proliferated, but people treat it differently. A lot of people in their homes are very reluctant to use it regularly because of the electricity costs and because they prefer fresh air to  conditioned air. Businesses often use it as an attractor for customers. When we're talking about people in prison, maybe it can be a privilege for the prisoners who work more and follow the rules. But I think that pushing it to the level of a right is premature. If someday solar energy infrastructure is so widespread that electricity costs go down to $4 a month, maybe we can talk.\n			>Would you say at any point heat doesn't become a human right. Some extreme examples would be 110 heat index and someone with high blood pressure?\n				>That's where the question actually lies, doesn't it? If A/C isn't provided because of cost that is one thing, but if it's not provided in attempts to *harm* the prisoner that's probably where it potentially runs into an 8th amendment issue.\n				\n				If the judge who provided sentencing to the prisoner didn't outline or bare minimum expect that heat exhaustion would be used as punishment I think the prison could be running afoul.\n					>Well the 8th amendment is vague on purpose because you can't enumerate all the ways that it could be used correct? Can it be side steps by a cost argument? \n					\n					Shouldn't the government provide the basic needs to creat a liveable (not comfortable) environment while under their care.\n						>I only think cost could be used to sidestep it because it wouldn't be a *punishment* to the prisoner at that point, but instead would be an externality to the original punishment.\n						\n						That being said, I think there's considerable evidence that the lack of AC is used as a punishment in of itself. I personally don't see it any different than if the prison established a new policy of whipping the prisoners at 5pm every day, it's just a different form of extrajudicial punishment.\n							>I think our opinions on what the prison system should be differ wildly. But I appreciate you taking the time to explore this deeper with me so I can understand your point of view.\n					>> If A/C isn't provided because of cost that is one thing, but if it's not provided in attempts to harm the prisoner that's probably where it potentially runs into an 8th amendment issue.\n					\n					Even if the second reason is the underlying reason, it's easy to always claim that cost is the reason. A/C will always be more expensive than no A/C (unless medical costs skyrocket or the prison has to defend expensive lawsuits).\n						>Probably depends on the jury if we're going to be realistic here. There is tons of senators, representatives, and even wardens that outwardly exclaim that they don't *want* prisoners to have AC even when cost isn't considered.\n						\n						I doubt this could ever play out in courts with that being said, so many procedural issues connected to suing for this.\n				>[removed]\n					>I understand heating has been around for a long time I don't believe that's in question here.\n						>[removed]\n							>I didn't bring it up in this thread but I did bring it up in my original starter comments is that what you were referring to? \n							\n							In the story say at least 10 prisoners died because of heat should that not be a concern as well? At some point any temperature high or low can kill and if we're protecting against low temperatures why shouldn't we protect against ultra high temperatures?\n								>[removed]\n									>Sorry heat as in the outside temperature. I didn't make myself clear, I will correct that to help other out. Thanks\n			>\>Yes, air conditioning has proliferated, but people treat it differently. A lot of people in their homes are very reluctant to use it regularly because of the electricity costs and because they prefer fresh air to conditioned air.\n			\n			When it comes to heat this is indeed a right in a more traditional sense; a lot of states and municipalities have specific [disconnection notice](https://ncler.acl.gov/Files/Protecting-Older-Adults-from-Utility-Disconnection.aspx) laws for seniors w.r.t. heating. I don't see why cooling would be that different.\n			\n			And if we already acknowledge that it's less luxury and more fundamental for surviving or thriving in an environment, I don't see it as that much of a stretch to think it's something prisoners should have.\n			\n			\>because of the electricity costs\n			\n			I don't think there's many people who would say 'Yeah it's totally fair and great that some people can't afford air conditioning'. People make that argument for, like, iPhones and other 'millenial panic' luxuries, but AC has been around long enough, like you said, to thoroughly proliferate.\n				>I'll say that it's fair and great. In my opinion no one is entitled to anything. Not food, not clean water, nothing that a caveman wouldn't be entitled to. Everything else you earn. Or ask for. We can make it easier to earn, and more likely to say yes if you ask for it, but I think that it's more important to have a universal and perpetual principle of law than to have it creep based on technological advancement.\n					>\>In my opinion no one is entitled to anything.\n					\n					Depending on what you mean by entitled, I agree! I think that natural law arguments are appeals to the supernatural personally.\n					\n					\>Everything else you earn.\n					\n					'Earn' is a normative judgment that is largely based on opinion or personal morality.\n					\n					At the end of the day, if providing air conditioning to both the impoverished and prisoners produces better outcomes, then we should do it, IMO. I don't think that universal perpetual principles of law are very healthy for a society to have. Stability is great, but neither the universe nor human technological circumstance cares much for it, and it seems foolish to pretend otherwise.\n	>The Supreme Court has repeatedly, going up to Gorsuch in [Bucklew, 2019](https://harvardlawreview.org/2019/11/bucklew-v-precythe/) defined “unusual” in cruel and unusual to mean “long disused” or not customary. The court doesn’t consider if a punishment would be unusual to someone in 1791 — nor to someone in 1689, as the phrase “cruel and unusual” is just taken from the English Bill of Rights. \n	\n	In [Trop v. Dulles](https://www.oyez.org/cases/1956/70), the court ruled that the term unusual tied the eighth amendment to \n	\n	> evolving standards of decency that mark the progress of a maturing society.\n	\n	Even Scalia, in [Harmelin v. Michigan](https://supreme.justia.com/cases/federal/us/501/957/#tab-opinion-1958878) interpreted “unusual” to mean not “in common use” meaning common use today, not 1719.\n	\n	The current court finds that the death penalty to not be unusual, because it’s been a traditional punishment in common use going up to the present. However, by this standard, they might find lack of air conditioning to be unusual — it is unusual in the present day for government buildings to lack air conditioning.\n	>That’s like arguing that the First Amendment only applies to ye olde printing press and people shouting in the town square.\n	>When you're violating [international law](https://www.theguardian.com/world/2014/apr/23/teas-prisons-international-human-rights-standard-violations) you're doing something wrong.\n		>When some third-world country violates international law, they're doing something wrong. When the US does it, that's different.\n",1623846468.0,2,2,2,2
ModeratePolitics,t3_o0vkop,h1yy8ov,">>“The vaccine works, and we encourage Arizonans to take it. But it is a choice and we need to keep it that way,” said Governor Ducey. “Public education is a public right, and taxpayers are paying for it. We need to make our public universities available for students to return to learning. They have already missed out on too much learning. From K-12 to higher education, Arizona is supporting in-person learning.”\n\nIs Arizona still having that much trouble with the vaccine rollout? I don't see how requiring the vaccine would limit access anymore than the vaccinations they already require.\n	>Arizona hasnt ever had trouble with the vaccine rollout, anyone that wants it can easily get it here\n",1623853122.0,2,3,2,2
ModeratePolitics,t3_o0vkop,h1yplsx,">At this point, why bother forcing the issue. If you are vaccinated, you're protected, if you're not, you may face hospitalization. The consequences fall entirely on the individual's shoulders.  What am I missing here? Why are vaccinated people still bothering to wear masks, I might add? People criticize other groups for being anti-science, then proceed to act anti-scientifically.\n	>> What am I missing here? Why are vaccinated people still bothering to wear masks, I might add?\n	\n	There are two reasons that, when taken into consideration, explain why.\n	\n	The vaccine is very effective, but not 100% effective. There are still instances of vaccinated people contracting COVID, though in all those cases the symptoms are mild and there have been no cases of a vaccinated person requiring hospitalization as a result.\n	\n	The point of masks is not to prevent the wearer from contracting COVID, but to prevent the wearer from spreading COVID. I'm not sure where the myth that the primary purpose of masks is to protect yourself came from but it's certainly a damaging myth.\n	\n	So because a vaccinated person can still carry COVID, and the primary purpose of wearing a mask is to prevent the wearer (in this scenario a vaccinated wearer) from spreading COVID, there's still a good reason for a vaccinated person to wear a mask.\n	\n	Personally, anecdotally, mask mandates in my area have been lifted. It's now up to the individual businesses to decide if they want to require masks. Honestly, I'm seeing a 50/50 split of establishments that do or don't require masks.\n		>Last year\n		https://www.npr.org/sections/health-shots/2020/11/11/933903848/wear-masks-to-protect-yourself-from-the-coronavirus-not-only-others-cdc-stresses\n		\n		Obviously not their *primary* purpose (to protect the wearer) and it depends on the type of mask (but they do)\n		\n		Edit: bad wording\n			>> Obviously not their primary purpose \n			\n			Not sure I follow. That article seems to be backing up that the primary purpose to to prevent an infected person from transmitting the virus but there's mounting evidence that it can protect the wearer as well.\n				>Sorry just worded it badly.  Not their primary purpose to protect one's self but they do protect the wearer\n		>Perhaps\n	>For colleges the concern is that if only half the population is vaccinated, you can still end up with a huge outbreak which is going to cost a ton of money to deal with. This law essentially forces AZ schools to setup testing and quarantine infrastructure that they otherwise wouldn't have to.\n		>Interesting to see how it plays out.\n	>I sort of agree but at the same time, I'm willing to give benefit of the doubt to people taking extra precaution from a deadly disease over those completely ignoring any caution at all. Yeah, people wearing masks when vaccinated isn't following CDC recommendation but it isn't exposing themselves to risk, and more importantly isn't exposing anyone else to risk\n		>You're probably right.\n	>Vaccines are not 100%.  You can still get and still transmit in some cases, but avoid life threatening health effects. \n	\n	Some people are not able to get vaccines for legit reasons.\n	\n	The mask is most infected on the sick person, not the healthy person. \n	\n	It does not only affect 1 person, and that is why we use terms like herd immunity.\n	\n	Kids can not get the vaccine because it has not been approved on them yet. \n	\n	Edit : here are some sources to start with\n	\n	http://www.healthdata.org/covid/covid-19-vaccine-efficacy-summary\n	\n	https://www.hopkinsmedicine.org/health/conditions-and-diseases/coronavirus/coronavirus-face-masks-what-you-need-to-know#:~:text=A%20mask%20can%20also%20be%20somewhat%20effective%20in,to%20others%20before%20they%20realize%20they%20have%20it.\n	\n	https://www.ucsf.edu/news/2020/06/417906/still-confused-about-masks-heres-science-behind-how-face-masks-prevent\n	\n	https://en.m.wikipedia.org/wiki/Herd_immunity\n		>Good reasons. I guess the virus will only hospitalize people who have not been vaccinated, and wearing a mask is to protect them. More than they deserve.\n	>My concern with a reasonable-sized unvaccinated population is mutation, personally. Every new infection is a chance to mutate and every mutation is a chance to reduce vaccine effectiveness. Mutation may be super unlikely, and the right mutation to beat the vaccines we have even more so, but I'd still like us as a population to try and continue to cut back on how many times we're rolling the dice on the issue.\n",1623848856.0,2,1,2,2
ModeratePolitics,t3_o0vkop,h1y4znh,">This might just be cover to help them avoid lawsuits if the vaccine turns out to have side effects down the line.\n\nEdit: Guys I'm just spitballing here. This isn't outside the realm of possibility.\n	>The vaccines do side effects.  They are documented and patients are given that information.  There is zero indication that new side effects will appear more than two weeks after vaccination.  That’s just not a thing.\n	>Let's hope to God there aren't any major, unexpected side effects! Not just for the physical wellbeing, but that would be absolutely terrible for trust in vaccination.\n		>It would also be a huge blow to mRNA vaccine technology, which has enormous potential.\n	>Good point\n",1623833149.0,3,3,2,3
ModeratePolitics,t3_o1djh0,h2080nn,">Joe Manchin watch continues. Manchin has said that he would support a smaller voting rights bill and shared with Schumer the things he would support. Notably his list includes a Republican ask in requiring a form of Voter ID to vote. Manchin's list\n\n-Election Day Federal Holiday\n\n-15 Days of Early Voting for Federal elections\n\n-Banning Partisan Gerrymandering \n\n-Automatic Voter Registration through the DMV\n\n-Voter ID requirement\n\n-Require outside advocacy groups who spend on Federal elections to disclose donors who give $10,000 or more during an election cycle\n\nEven with a more focused bill, the chances of attracting any meaningful Republican Support in the Senate to clear the filibuster threshold seems remote\n	>I’m fine with Voter ID as long as said IDs are provided for free to the public, otherwise it’s a poll tax, even if it’s a “cheap” poll tax.\n		>Article doesn't go into a ton of detail but it seemed it would be a liberal definition of Voter ID, the example provided being a utility bill\n		>Georgia provides them for free and we saw what people think of that. \n		\n		I however completely agree with you\n			>To be fair, there is more to it than simply being free, it's also making it accessible. Some states have vans that literally drive out to you if needed for example, others don't.\n			\n			And that is really the crux for many when it comes to Voter ID, most are for it, me included, but that means also making it easy/free to get one, regardless of your circumstances, and that means having programs that make sure that happens.\n		>Every state that requires one, also provides them for free to those who dont have one.  The complaint then becomes that people have to actually get documents and head over to a govt office. If you dont have those documents, they can even help with that.\n		\n		We really are kind of a laughingstock to the world in this regard.  The vast majority of countries require a photo ID to vote, dont have voting holidays, many dont even offer absentee ballots or make it very hard to get one, and other basic limits to safeguard voting.\n	>>Even with a more focused bill, the chances of attracting any meaningful Republican Support in the Senate to clear the filibuster threshold seems remote\n	\n	I agree. Even if the bill was literally just everything on that list, I don't see the GOP going for it. I think the main issue is the partisan gerrymandering piece. Like it or not, that is one of the advantages they have right now, and eliminating it harms them while leaving other forms of gerrymandering in place that currently benefits Democrats. \n	\n	Now if we keep partisan gerrymandering, or maybe give the courts a way to measure when it is too partisan, then that may be something that could work.\n		>When you refer to “other forms of gerrymandering which currently benefit democrats” what exactly are you referring to?\n			>Primarily majority minority districts.\n			>Maryland is a bit notorious for how gerrymandered it is.\n	>I like this list. I think wholeheartedly accepting the Voter ID ask would placate a few Republicans. IDK how many, but auto reg at the DMV passes the smell test much more than same-day, so it's hard to find a huge sticking point.\n	\n	Honestly, the biggest hurdle to attracting votes would be banning gerrymandering (depending on how porously the bill is written)...even if they don't say that part out loud.\n	>I've said this before but Manchin can't even get 10 Republicans to support reauthorizing the Voting Rights Act, which used to be a formality. That being said, I would be fine trading a national voter ID in exchange for getting rid of partisan gerrymandering. I just can't see getting 10 Republican Senators to agree.\n	>>-Election Day Federal Holiday\n	\n	>-15 Days of Early Voting for Federal elections\n	\n	>-Banning Partisan Gerrymandering \n	\n	>-Automatic Voter Registration through the DMV\n	\n	>-Voter ID requirement\n	\n	>-Require outside advocacy groups who spend on Federal elections to disclose donors who give $10,000 or more during an election cycle\n	\n	That all seems reasonable to me. \n	\n	Which means it's not gonna pass.\n",1623872764.0,2,2,2,2
ModeratePolitics,t3_o196hl,h1ziyw2,">Last year, I started hearing talk of this 'Office 67', a particularly brutal officer when it came to protests. It was hard to know what to make of it given how much everyone involved was trying to distort coverage to their own narrative. However, it now appears that at least this one officer almost certainly went too far in how they dealt with protestors.\n	>So how far does someone need to go from being a 'protestor' to recognizing they're a rioter? One should ask how the police came to be involved in the first place.\n		>If you read the article one of the incidents pretty clearly doesn't involve protestors. Homeowner's home was filling with tear gas, goes out to talk to officer gets hit from behind in the back of the head by Kammerer.\n		>Someone who spits in front of the police is a protestor. Just because other people in the crowd were crossing the line into rioting doesn't give the police free reign to beat the shit out of peaceful (if rude) protestors and then lie about it.\n			>> Just because other people in the crowd were crossing the line into rioting doesn't give the police free reign to beat the shit out of peaceful (if rude) protestors and then lie about it.\n			\n			It does give the police the right to arrest those who are rioting though. \n			\n			Which brings up the follow-up question: \n			\n			Are you a 'peaceful protestor' if you're not personally rioting yourself, but you're deliberately preventing the police from apprehending those among you who are?\n			\n			I would argue that while it doesn't necessarily make that person a 'rioter', it does disqualify them from the innocence of being considered a 'peaceful protestor'.\n",1623862016.0,2,2,2,2
ModeratePolitics,t3_o1d91q,h206zw8,">Looks like the Federal Reserve has back tracked a bit on their inflation expectations although they still view the current inflation pressure is transitory and that much of the inflation growth is due to a bounce back from depressed activity levels in 2020. As the article says, this meeting does appear to have caused a drop on the stock market, although it is does appear to be a small one. At the time of this post, the DOW is down .6%. \n\nDoes this change the Biden admin's path forward on their spending plans? [With a recent Monmouth poll showing 47% were very concerned with inflation and 24% were somewhat concerned](https://thehill.com/homenews/administration/558736-7-in-10-concerned-spending-in-biden-plans-could-lead-to-inflation), do they need to make adjustments to ease inflation fears?\n	>> Looks like the Federal Reserve has back tracked a bit on their inflation expectations although they still view the current inflation pressure is transitory and that much of the inflation growth is due to a bounce back from depressed activity levels in 2020. \n	\n	Sounds about right honestly. The price of things like flying and hotels absolutely collapsed during the pandemic and is surging now. I flew to LA last year from Houston for $100 roundtrip and going to Atlanta last month cost me almost $500!\n",1623872326.0,3,3,3,3
ModeratePolitics,t3_o1d91q,h209743,">Probably tangential, but I'm curious to see what effect this will have on prices of materials and raw resources.\n",1623873266.0,3,3,3,3
