Subreddit,SubmissionID,CommentID,text,date,Stephen,TJ,Alexis,Veronica
ModeratePolitics,t3_o15fku,h1yvc6t,">A bullet-point overview from the White House detailing what the Biden administration has done regarding immigration in these first few months. Topics cover:\n\n* Improved Processing of Unaccompanied Children\n* Removed Barriers to Unifying Children with Parents and Sponsors\n* Put in Place Orderly Processes and Protocols at the Border\n* Expanded Lawful Pathways for Protection and Opportunity\n* Enhanced Migration Management\n* Addressed the Root Causes of Migration\n\nMy key takeaways:\n\n1. Not a great look by the administration to start this statement with mentioning '4 years of chaos and mismanagement'. Let the facts speak for themselves. \n2. I'm a bit skeptical about the numbers used, given the above. Since the processing statistics compare current values to those from March/April, one has to wonder why these were chosen over other options (start of Biden administration, this time last year, etc).\n3. Lots of attention for Honduras, El Salvador, and Guatemala. This isn't necessarily a bad thing IMO, but certainly worth mentioning.\n4. The Biden administration does not reliably use the Oxford comma. Pretty sure that's an impeachable offense.\n	>Ugh, they actually do use it several times in this post. So they are inconsistent... which might actually be worse.\n		>Good catch. It appears the usage improves further down in the overview. I agree though; inconsistent usage is probably worse.\n			>To me, this is akin to the old Van Halen 'No brown M&M's' demand in their rider. Look at a document with inconsistent usage of the oxford comma, and you know it hasn't been carefully looked at.\n			>It is worthy of rebuking, censure or impeachment.\n	>>	The Biden administration does not use the Oxford comma. Pretty sure that's an impeachable offense.\n	\n	Absolutely unforgivable.\n	>> Lots of attention for Honduras, El Salvador, and Guatemala. This isn't necessarily a bad thing IMO, but certainly worth mentioning.\n	\n	Well considering that is where the majority of our illegal immigrants are coming from it makes sense right?\n	>> The Biden administration does not use the Oxford comma.\n	\n	God Damn son of a .....\n		>I think we might be able to ask the Mods for a rule 1 exception here.\n	>>Addressed the Root Causes of Migration\n	\n	Allow me to contain my disbelief. Nope, couldn't do it.\n",1623851754.0,3,3,2,3
ModeratePolitics,t3_o15fku,h1yx0ad,">So basically the only things they are doing to address illegal immigration occurring now is targeting human trafficking, which was probably already occurring, and radio ads. So essentially just open the gates, let them in, and continue to overwhelm our existing legal immigration infrastructure. Solid plan.\n	>Question is has any party really done anything to fix undocumented immigration\n	\n	I mean only real solution to curbing undocumented immigration is lessen red tape, create point system to immigration, decriminalizing drugs possession, changing border safety mission to humanitarian/medical effort, go from criminal to civil with undocumented immigration, and offer more benefits to those paying income taxes/US citizens\n		>To add to that: we also need to offer fewer benefits to illegal immigrants, and we need to better protect our border.\n		\n		We can expand legal immigration while also coming down hard on illegal immigration. Doesn't have to be an either/or.\n			>Neither party supports the platform of 'expand legal immigration, crack down on illegal immigration'.\n			\n			For my money, if I have to choose between the two, I'm choosing the former; the economic arguments for the latter haven't borne any fruit and have a lot of counterevidence, and there are looming domestic crises that immigration of any kind will absolutely help with/solve.\n				>> Neither party supports the platform of 'expand legal immigration, crack down on illegal immigration'.\n				\n				Welcome to the current two-party system, where compromise is apparently not possible.\n				\n				> looming domestic crises\n				\n				Got any examples to spur discussion?\n					>\>Got any examples to spur discussion?\n					\n					Demographic collapse is remediable with immigration. There's not much evidence that there's a way to get first world country populations to start reproducing at third world country rates, so an influx of new first genners can help stabilize the base.\n						>There have been [examples in the past](https://www.theguardian.com/world/2011/oct/14/alabama-immigration-law-workers) as well where cracking down on illegal immigration has been pretty damaging to the agricultural industry\n					>Likely referring to the decline in births in Western Countries which immigration could help alleviate. NYT did a good segment on it that is probably worth its own post. The US has been somewhat shielded due to immigration\n					\n					https://www.nytimes.com/2021/05/22/world/global-population-shrinking.html\n				>I may not be reading your comment correctly.   \n				\n				\n				Just want to say the native USA population is declining and will continue to do so. The only way our population is growing right now is through immigration.   \n				\n				\n				The GDP is highly dependent on getting new workers.\n					>True, but it would be better if that is handled through a point based system where we can put emphasis on skills needed.\n						>We have that, the points are called 'dollars'. Govt deciding on what skills the economy needs is called command economy, and generally conservatives are against those.\n							>There are many countries that are not command economies yet have point based immigration systems.\n								>Sure, but do point based systems *work*?\n								\n								[All the research I'm familiar with](https://budgetmodel.wharton.upenn.edu/issues/2016/1/27/the-effects-of-immigration-on-the-united-states-economy) suggests that essentially unrestricted immigration is the best opportunity we have for long-term growth.\n								\n								Meanwhile, there's no evidence (none) that points-based immigration works better than more open methods; in fact, most studies find that GDP per capita and productivity grows *more* per low-skill worker entry than high-skill worker entry.\n									>More open methods aren't really an option, so whether they work better or not is irrelevant.\n									>> All the research I'm familiar with suggests that essentially unrestricted immigration is the best opportunity we have for long-term growth.\n									\n									'free market immigration'\n								>That's fine, they are still overriding the market deciding the value of labor \*just as much\* as any minimum wage policy, and with demonstrably broader impacts.\n									>The market will still determine the value of labor, the government will just set the rules for immigrating to the country on a point based system.\n							>Points\n							\n							High skills needed 50 points\n							\n							Have loans to start business here 50 points\n							\n							Employee sponsorship automatic entry\n							\n							Government/Military sponsorship automatic entry\n							\n							Graduate degree 40 points\n							\n							Bachelor degree 30 points\n							\n							Associate degree 20 points\n							\n							US High School diploma/GED equivalent 10 points\n							\n							Direct family members living in the US 10 points\n							\n							40 points if healthcare provider that can be equivalent to profession in the US\n							\n							30 points if master level or higher IT or engineer or scientist\n							\n							Negative points \n							\n							If entered US undocumented 10 points up to 30 points 3 times barred unless a refugee\n							\n							Banned if bringing drugs into the US\n							\n							30 points if had a felony equivalent arrest\n							\n							10 if any minor arrest/infractions with the law\n					>I agree, that was my point.\n		>Not really but the number of illegal immigrants in the United States and as a percentage of the American workforce, has been dropping for a long time, principally because Mexican illegal immigrants have returned to Mexico in very large numbers.\n",1623852546.0,2,2,2,2
ModeratePolitics,t3_o15fku,h1zr9up,">I'm going to sound like a conspiracy nut here but it's a little odd to include the VP's name when referring to the WH administration, isn't it?  Is it just because she's been working immigration issues?  Have previous administrations done this when making press releases related to projects the VP has been focusing on?\n	>I don't think it's that conspiratorial to suggest Harris' name is put more front and center to help build her resume for another potential presidential run. It would make sense since Biden is bearly 80 and has already made statements that he may not run in 2024\n	>It is a little odd, but I imagine they are trying to give her credit because she has spearheaded this issue.\n		>It’s odd, and the border crisis is not the only place it’s been showing up. It’s even on the [official White House website](https://www.whitehouse.gov/administration/).\n			>huh, 'Second Gentleman,' that's interesting, never even thought of that\n				>It does sound a bit weird, right? Though I expect that’s just because it’s new. \n				\n				Part of me thinks it’d be… interesting if the offices of FLOTUS and SLOTUS didn’t change their names to reflect their occupants. Like some sort of dusty old rule that would make it unconstitutional to do so. But the US government doesn’t exist to make me chuckle.\n					>FGOTUS and SGOTUS sure don't flow off the tongue\n					\n					SPOTUS (partner) works, but sadly FPOTUS doesn't\n						>POTUS SLOTUS AMOGUS  \n						This is the descent of America in real time. Time to give the keys to Canada.\n							>'You're drunk America, go sleep it off!'\n					>[deleted]\n						>I’ll be honest, no idea if that’s the official acronym, I just followed the pattern. But yeah typing it out it feels like smothering way less SFW than it is.\n",1623865580.0,2,3,2,3
ModeratePolitics,t3_o13gwa,h1yk9zm,">**John Oliver had a segment this week but can't link to it, and most articles that dealt with the topic are stale, behind a paywall, or a brief summary of the program with a link to the video included.  So this Policy review is from June 18, 2019.**\n\nThe topic is should the prison population have access to air conditioning?\n\nSome at least 13 states (some states have no data on this): Alabama, Arizona, Florida, Georgia, Kansas, Kentucky, Louisianna, Mississippi, Missouri, N. Carolina, S. Caroline, Texa, Virginia lack AC.\n\nWhy is AC needed? Because people who are incarcerated have various health conditions, some that can make dehydration and heat stroke a higher risk. Conditions like high blood pressure, asthma, diabetes, or psychotropic medication. This has in the past led to deaths from inadequate cooling.\n\nSome states refuse air conditioning as an appearance to be tough on crime. But Wisconsin, Arizona, Mississippi have already ruled that incarceration in extremely hot or cold temperatures violates the eight amendments.\n\nA few things to ask the community:\n\n* We never hear that prisons don't install heating (I'm from the northern states); why is AC any different?\n* Is the lack of AC against the 8th amendment?\n* Is the lack of AC a crime deterrent?\n* Should the US Prison systems act as a deterrent on crime or a place to rehabilitate, or both?\n	>>Some at least 13 states (some states have no data on this): Alabama, Arizona, Florida, Georgia, Kansas, Kentucky, Louisianna, Mississippi, Missouri, N. Carolina, S. Caroline, Texa, Virginia lack AC.\n	\n	There’s some seriously hot states on that list. There’s evidence that hotter temperatures lead to violent crime. So having a hot, angry populace with criminal tendencies seems like a terrible situation, for both the inmates and guards.\n	\n	As to why AC is different than heat, it’s not seen as essential to life in the same way. I never went to a school that had AC and have lived in homes without it. This is getting rarer, but at the time, I would have been hard pressed to be upset prisoners didn’t have AC when I was sweating my own rear end off. It can be expensive to retrofit buildings for it, and spending money on criminals is not popular.\n		>Thanks for your life experiences, I was also very similar to you growing up, it's would be different for a person with high blood pressure, asthma, or diabetes they would be vulnerable to high temperatures. \n		\n		Being cool on an 85-degree day or staying indoors vs a high humidity 105 and above day are too very separate conditions and AC in many contexts feels luxurious but when you are a ward of the state and they can't cancel school for excessive heat or you can't go to the refriedge to crack open a cold drink to cool yourself off experiences can differ especially on days of excessive heat warnings.\n		\n		Excessive heat is my main concern and creating liveable connections for all inmates. I feel our society should treat our lower class with some humanity as well. That was what I tried and believed failed to highlight.\n	>I think focusing on AC while not considering other measures to control temperature and ensure people don't overheat is flawed. I used to be a welder and the Texas summers could be brutal sometimes. But being indoors, out of direct sunlight with adequate airflow made for a pretty easy day. Even when I was in full leathers. Now do these same prisons have adequate airflow? Do they make water available in sufficient quantities? Now if they don't have AC, don't have adequate airflow, and don't make water available in sufficient quantities then that is a violation of the 8th amendment. AC is not required to satisfy the 8th amendment.\n		>At a certain temperature those other means of cooling don't work for instance the CDC doesn't recommend water misters above a heat index of 105. So what about those conditions?\n			>When the heat index is 105 outside, go inside. If they have sufficient airflow and access to water then that should be fine.\n				>There are conditions that will be at a higher risk or death because of heat, because 10 people died I would say that is not adequate advice for all inmates. Would you agree?\n					>Certainly, and inmates with medical conditions that make them prone to heat related issues should probably be moved to facilities that can accommodate those conditions. That is probably a fairly small number of people though.\n						>I don't know what size that at risk population is based on the data provided.\n							>That seems like a requirement to really make a judgement here. Without that data, the question is should AC be a requirement under the 8th amendment for all of the prison population? In my opinion, that answer is no because it is pretty easy to stay cool for individuals that don't have medical conditions that are exacerbated by high temperatures when they are indoors with access to water and adequate airflow.\n	>> Should the US Prison systems act as a deterrent on crime\n	\n	Prison under any conditions acts as a deterrent around [1.24% of the time](https://www.econstor.eu/bitstream/10419/34351/1/557359392.pdf). If the cruelty of prison is designed as a deterrent, it's doomed to fail. If we proposed other policies similar to prison that would have a 1.24% reduction in their targeted goal, we'd (rightfully) disregard them.\n	\n	Oh, and in the US, [prison has 'on balance, no rehabilitative or deterrent effects after release.'](https://www.nature.com/articles/s41562-019-0604-8)\n	\n	On the rehabilitation side, what we do [isn't effective](https://www.ncbi.nlm.nih.gov/pmc/articles/PMC3762476/?_escaped_fragment_=po=96.1538). The mere teaching of 'life skills' doesn't (per the prior study) show any capacity for rehabilitation. In fact [our prisons have recidivism up to 20% higher than some of our peer countries](https://www.ncbi.nlm.nih.gov/pmc/articles/PMC6743246/).\n	\n	So to get back to your question,\n	\n	> Should the US Prison systems act as a deterrent on crime or a place to rehabilitate, or both?\n	\n	It doesn't seem prison *can* have deterrent effects, so we should focus on solving why people commit crime to begin with and combine it with rehabilitation.\n		>Prison's primary benefit is incapacitation, not deterrence or rehabilitation.  Someone in a cell can't commit crimes against the broader public.  \n		\n		So even if we assume that prison is only 1% effective at deterring crimes in advance, it is nearly 100% effective at either (a) stopping crimes or (b) isolating the crimes to the inside of a prison while the criminal is still in jail.\n		>Well, prison is very effective at providing incredibly cheap labor.\n	>The prison system SHOULD BE about rehabilitation, as it claims, but the corporations running them would go out of business if that were true.  \n	\n	Also:  I doubt a lack of AC is a functional deterrent.  I can see criminals gathered, discussing criminal activities, when one says, 'I can handle being in a cage, I can handle getting raped, I can handle people trying to kill me...wait, they don't have AC in prison?  Ok, I'm out.'\n		>The primary purpose of the prison system is incapacitation, not rehabilitation.  We put people in jail so they can't commit more crimes out in society, not because jail is going to fix them.  \n		\n		If the goal was to 'cure' someone's propensity to commit crimes, jail would be a terrible place to do it.\n",1623845762.0,2,2,2,2
